{
  "$schema": "http://json-schema.org/draft-07/schema#",
  "$id": "https://raw.githubusercontent.com/kevinboss/chapter-review/main/.claude/skills/chapter-review/chapters.schema.json",
  "title": "Chapter review manifest",
  "description": "Partition of a branch diff into logical review chapters. Written by the chapter-review skill to <git-dir>/chapter-review/chapters.json (tool state inside .git, keeping the worktree clean), consumed by the chapter-review VSCode extension. Structural rules only; the partition rules (every hunk in exactly one chapter or unassigned, no overlaps) are enforced by validate.ts alongside this file, which is authoritative if the two disagree.",
  "type": "object",
  "required": ["version", "base", "head", "mergeBase", "generatedAt", "chapters", "unassigned"],
  "additionalProperties": false,
  "properties": {
    "version": {
      "const": 1,
      "description": "Contract version. Consumers must reject manifests with a version they don't know."
    },
    "base": {
      "type": "string",
      "minLength": 1,
      "description": "Ref the branch is reviewed against, usually the default branch."
    },
    "head": {
      "type": "string",
      "minLength": 1,
      "description": "The branch under review."
    },
    "mergeBase": {
      "type": "string",
      "pattern": "^[0-9a-f]{7,40}$",
      "description": "git merge-base <base> <head> at generation time. The diff that was partitioned is mergeBase..head."
    },
    "headSha": {
      "type": "string",
      "pattern": "^[0-9a-f]{7,40}$",
      "description": "Commit head resolved to at generation time. Hunk coordinates refer to mergeBase..headSha; consumers use it to reconstruct exact content after the branch moves. Always record it."
    },
    "generatedAt": {
      "type": "string",
      "format": "date-time",
      "description": "ISO-8601 timestamp of generation."
    },
    "summary": {
      "type": "string",
      "description": "One or two sentences on what the branch does overall. Optional."
    },
    "chapters": {
      "type": "array",
      "items": { "$ref": "#/definitions/chapter" }
    },
    "unassigned": {
      "type": "array",
      "description": "Quarantined noise: lockfiles, snapshots, generated code, pure autoformat hunks. Always present, may be empty.",
      "items": { "$ref": "#/definitions/unassignedFile" }
    },
    "issues": {
      "type": "array",
      "description": "Per-chapter review findings the chapter-review skill noticed and wants to surface; the extension displays them. Authored by the skill while it reviews the diff (and added to on request during follow-up); durable: the skill MUST carry this array across regeneration (re-mapping each issue's chapterId to the chapter that owns its path/hunk in the new partition, and renumbering its id into that chapter's sequence when the owner changes), never dropping findings. Optional; absent means none yet.",
      "items": { "$ref": "#/definitions/issue" }
    },
    "issueSeq": {
      "type": "object",
      "description": "Highest number ever allocated in each chapter's issue sequence, keyed by the chapter number an id carries (\"1\" for ch-1, \"0\" for findings with no chapter). Owned by `chapter-review issue`; never author it. Retained when a finding is removed, or when one is renumbered into another chapter, so an id is never reused by a later `issue add` — findings get quoted into PR comments and chat, where a recycled id would point at a different problem.",
      "propertyNames": { "pattern": "^(0|[1-9][0-9]*)$" },
      "additionalProperties": { "type": "integer", "minimum": 1 },
      "$comment": "Absent means no finding has ever been added."
    }
  },
  "definitions": {
    "issue": {
      "type": "object",
      "required": ["id", "path", "severity", "note"],
      "additionalProperties": false,
      "dependencies": { "cause": ["line"] },
      "not": { "anyOf": [{ "required": ["cause", "hunk"] }, { "required": ["cause", "oldPath"] }] },
      "properties": {
        "id": {
          "type": "string",
          "pattern": "^iss-[0-9]+\\.[1-9][0-9]*$",
          "description": "Issue ID, unique within the manifest: iss-<chapter number>.<number within that chapter>, so iss-2.1 is the first finding in ch-2 and 0 is the sequence for findings with no chapter. The chapter part MUST match chapterId. A finding that changes chapter is renumbered into the new chapter's sequence; otherwise it keeps its id, across regeneration included."
        },
        "path": {
          "$ref": "#/definitions/path",
          "description": "File the issue is about: a file in the diff, or, when no chapter or unassigned entry holds it, a file the branch does not change but left wrong (a stale doc, a forgotten caller), which then needs line. With hunk or line, this is the durable key that survives regeneration."
        },
        "oldPath": { "$ref": "#/definitions/path" },
        "hunk": {
          "$ref": "#/definitions/hunk",
          "description": "Optional: the range the issue concerns. With line, the claimed range holding that line."
        },
        "line": {
          "type": "integer",
          "minimum": 1,
          "description": "1-based line in the file at headSha: the line the issue is about, which the extension opens at. Required for a path outside the diff. Carried to the matching line of the new head on regeneration."
        },
        "cause": {
          "type": "object",
          "required": ["path"],
          "additionalProperties": false,
          "description": "For a finding outside the diff: the change in the diff that left the file wrong. The finding's chapter is the one that owns this change, and is re-read off it on every write. Absent means no chapter owns the finding.",
          "properties": {
            "path": { "$ref": "#/definitions/path" },
            "hunk": { "$ref": "#/definitions/hunk" }
          }
        },
        "chapterId": {
          "type": "string",
          "pattern": "^ch-[1-9][0-9]*$",
          "description": "Soft grouping: the chapter it was noted under. Positional, so treat path(+hunk) as the real key. Absent means no chapter owns it (a quarantined path), which numbers the finding iss-0.<number>."
        },
        "severity": {
          "enum": ["critical", "high", "low"],
          "description": "How bad this one finding is, rated on its own harm and never on the harm of whatever sits beside it in the same file or hunk."
        },
        "note": {
          "type": "string",
          "minLength": 1,
          "description": "The finding: one problem, not two joined into one note. What needs two separate edits is two issues, each with its own severity, in the same hunk included."
        },
        "confidence": {
          "enum": ["suspected", "verified"],
          "description": "Whether the finding's premise has been checked. Omitted defaults to \"suspected\": noted on a read-through, premise not yet confirmed. \"verified\" means the premise was checked against the code. Lets a first-pass finding say \"verify before relying on this\", so a shaky note isn't read as settled."
        },
        "status": {
          "enum": ["open", "resolved"],
          "description": "Defaults to open when omitted."
        },
        "createdAt": {
          "type": "string",
          "format": "date-time",
          "description": "When the finding was first recorded. Set by `chapter-review issue add` and carried across regeneration unchanged, so it dates the observation rather than the manifest. Never author it; absent on findings recorded before this was stamped."
        }
      }
    },
    "chapter": {
      "type": "object",
      "required": ["id", "title", "files"],
      "additionalProperties": false,
      "properties": {
        "id": {
          "type": "string",
          "pattern": "^ch-[1-9][0-9]*$",
          "description": "Positional ID, numbered from 1 (0 is reserved: it is the issue sequence for findings with no chapter). Stable within one generation only."
        },
        "title": {
          "type": "string",
          "minLength": 1,
          "maxLength": 60,
          "description": "Imperative, e.g. \"Add OIDC provider\"."
        },
        "description": {
          "type": "string",
          "description": "Only when the why isn't obvious from the title."
        },
        "files": {
          "type": "array",
          "minItems": 1,
          "items": { "$ref": "#/definitions/file" }
        }
      }
    },
    "file": {
      "type": "object",
      "required": ["path", "status"],
      "additionalProperties": false,
      "properties": {
        "path": { "$ref": "#/definitions/path" },
        "oldPath": {
          "$ref": "#/definitions/path",
          "description": "Pre-rename path. Only meaningful with status \"renamed\"."
        },
        "status": { "$ref": "#/definitions/status" },
        "hunks": {
          "type": "array",
          "minItems": 1,
          "items": { "$ref": "#/definitions/hunk" },
          "description": "Omitted = the whole file's diff belongs to this entry, so ranges aren't enumerated. Fine for any file whose changes all sit in one chapter, not only added/deleted files: a modified file with several hunks that all belong here should omit hunks too. Present = only these hunks belong here; the file may then appear in other chapters with disjoint hunks."
        },
        "note": {
          "type": "string",
          "description": "Role of this file in this chapter. Only when the file is split and this entry's scope isn't obvious — across several chapters, or between a chapter and unassigned (where it flags which part is the real change). The unassigned side carries only its reason; note is forbidden there."
        }
      }
    },
    "unassignedFile": {
      "type": "object",
      "required": ["path", "status", "reason"],
      "additionalProperties": false,
      "properties": {
        "path": { "$ref": "#/definitions/path" },
        "oldPath": { "$ref": "#/definitions/path" },
        "status": { "$ref": "#/definitions/status" },
        "hunks": {
          "type": "array",
          "minItems": 1,
          "items": { "$ref": "#/definitions/hunk" },
          "description": "Omitted = whole file is unassigned. Present = only these hunks (e.g. autoformat noise in an otherwise meaningful file)."
        },
        "reason": {
          "type": "string",
          "minLength": 1,
          "description": "Why this was quarantined, e.g. \"generated\", \"snapshot\", \"autoformat\". When a hand edit elsewhere drove the change, name that driver by path (\"regenerated by the bump in foo/bar.json\") and never by chapter id: ids are stable only within a generation and nothing rewrites prose that cites them, so a cited id goes stale silently."
        }
      }
    },
    "status": {
      "enum": ["added", "modified", "deleted", "renamed"]
    },
    "path": {
      "type": "string",
      "minLength": 1,
      "pattern": "^[^/]",
      "description": "Repo-relative POSIX path, no leading slash."
    },
    "hunk": {
      "type": "object",
      "description": "Coordinates from a unified diff @@ -oldStart,oldLines +newStart,newLines @@ header.",
      "required": ["oldStart", "oldLines", "newStart", "newLines"],
      "additionalProperties": false,
      "properties": {
        "oldStart": { "type": "integer", "minimum": 0 },
        "oldLines": { "type": "integer", "minimum": 0 },
        "newStart": { "type": "integer", "minimum": 0 },
        "newLines": { "type": "integer", "minimum": 0 }
      }
    }
  }
}
